"Var1","Relation","Var2","Cor","Topic","Stage","Type","Confirmed","Notes","bibref"
"food sharing",">","division of labour: sexual","none","Human Ecology; Anthropology","none","","none","Reflects sexual division of labour as married women and women with children younger than 2 produce much less calories and get food by food-sharing within the houshold","dyble2016networks"
"food sharing",">","relatedness","none","Human Ecology; Anthropology","none","","none","Individuals tend to share food with related individuals. Highly related individuals within household and more related individuals within one’s cluster than the wider camp","dyble2016networks"
"food sharing",">","calorific value","none","Human Ecology; Anthropology","none","","none","Calorific value of food package determines how it is shared, food with higher calorie value are shared with wider reach of people","dyble2016networks"
"food sharing",">","camp size","none","Human Ecology; Anthropology","none","","none","Larger camps have more number of clusters, rather than bigger clusters","dyble2016networks"
"food-sharing cluster","~","food sharing","none","Human Ecology; Anthropology","none","","none","","dyble2016networks"
